<?xml version="1.0" encoding="UTF-8"?>
<!DOCTYPE transcript>
<transcript 
    xmlns:xsi="http://www.w3.org/2001/XMLSchema-instance"
    xsi:noNamespaceSchemaLocation="transcript.xsd">
    <university>
        <universityName>Kth</universityName>
        <person>
            <personName>Saman</personName>
            <ssn>8606261111</ssn>
            <degree>Datateknik</degree>
            <year>5</year>
            <courses>
                <course>
                    <name>Mate</name>
                    <point>5</point>
                    <id>id3333</id>
                </course>
                <course>
                    <name>Java</name>
                    <point>2</point>
                    <id>id2212</id>
                </course>     
            </courses>
        </person>
    </university>
    <university>
        <universityName>Su</universityName>
        <person>
            <personName>Alex</personName>
            <ssn>8309081111</ssn>
            <degree>Datateknik</degree>
            <year>5</year>
            <courses>
                <course>
                    <name>Matlab</name>
                    <point>3</point>
                    <id>id3333</id>
                </course>
                <course>
                    <name>C++</name>
                    <point>3</point>
                    <id>id2212</id>
                </course>     
            </courses>
        </person>
    </university>
</transcript>
